{"base_main_heads":{"cc_gateway":"9ca9ea72d881fccd2cfb3fd1b939a2f56db69516","sub2api":"d5a42bbd24d15af2ce7646d050a5ae5c77911d4f"},"compatibility_policy":"phase_0_additive_only_breaking_requires_new_version_and_migration_test","destruction_procedure":"git_revert_artifact_commit_after_security_approval","entry":{"digest":"sha256:e6d7426c63f8bf96a91de5c47d9fc6807fae5da68ad507e8ba65b93f2732f235","path":"docs/superpowers/evidence/p0-1/p0-1-entry-baseline.json"},"entry_schema_digest":"sha256:b692470449826fcd3c8ab19525ae4cb1d1c45f98ee8f2bfc5557165a1ec3880b","generated_at":"2026-07-12T21:41:35.241Z","receipt_kind":"governance_amendment_entry_receipt","receipt_path":"docs/superpowers/evidence/p0-1/p0-1-entry-baseline.receipt.json","receipt_schema_digest":"sha256:937f1298d55018781e751cd847be237e2a066cd53f390f060acdcfc6c0cfb54b","redaction_policy":"digests_and_safe_redacted_excerpts_only","retention_class":"phase_evidence_permanent","reviewed_tool_head":"4b52677dbceef446e63bc207a795c84b872f38dd","schema_version":1}
